{
  "fromDate": "2020-01-01",
  "toDate": "2020-01-31",
  "income": {
    "periodAmount": 200,
    "premiumsOfLeaseGrant": 200,
    "reversePremiums": 200,
    "otherIncome": 200,
    "taxDeducted": 100,
    "rentARoom": {
      "rentsReceived": 100
    }
  },
  "expenses": {
    "premisesRunningCosts": 200,
    "repairsAndMaintenance": 200,
    "financialCosts": 200,
    "professionalFees": 200,
    "costOfServices": 200,
    "other": 200,
    "travelCosts": 200,
    "residentialFinancialCostsCarriedForward": 200,
    "residentialFinancialCost": 200,
    "rentARoom": {
      "amountClaimed": 200
    }
  }
}
